{"concerns":[{"acceptedMechanisms":["bounded-conformance-campaign"],"concern":"law.conformance","minimumAssurance":"per-declaration-one-accepted-applicable-support-no-selected-challenge","priority":"required"},{"acceptedMechanisms":["bounded-conformance-campaign"],"concern":"resource.persistence","minimumAssurance":"per-declaration-one-accepted-applicable-support-no-selected-challenge","priority":"required"},{"acceptedMechanisms":["bounded-conformance-campaign"],"concern":"effect.conformance","minimumAssurance":"per-declaration-one-accepted-applicable-support-no-selected-challenge","priority":"required"},{"acceptedMechanisms":["proof","proof-audit"],"concern":"performance","minimumAssurance":"per-declaration-one-accepted-applicable-support-no-selected-challenge","priority":"optional"}],"id":"ordered-map-bounded-policy","kind":"consumerPolicy","profile":{"id":"ordered-map-ascii-fold","kind":"realizationProfile","version":"0.1.0"},"prohibitions":[{"acceptedEvidenceScope":["adapter-invocation-trace"],"description":"No io.* events inside the adapter-observed invocation trace.","eventPattern":"io.*","proposition":{"declarationId":"ordered-map-effects","specification":{"id":"ordered-map","kind":"specification","version":"0.2.0"}}}],"specification":{"id":"ordered-map","kind":"specification","version":"0.2.0"},"version":"0.2.0"}
