{
  "kind": "consumerPolicy", "id": "stack-bounded-policy", "version": "0.2.0",
  "specification": {"kind": "specification", "id": "stack", "version": "0.2.0"},
  "profile": {"kind": "realizationProfile", "id": "stack-default", "version": "0.1.0"},
  "concerns": [
    {"concern": "law.conformance", "priority": "required", "acceptedMechanisms": ["bounded-conformance-campaign"], "minimumAssurance": "per-declaration-one-accepted-applicable-support-no-selected-challenge"},
    {"concern": "resource.persistence", "priority": "required", "acceptedMechanisms": ["bounded-conformance-campaign"], "minimumAssurance": "per-declaration-one-accepted-applicable-support-no-selected-challenge"},
    {"concern": "effect.conformance", "priority": "required", "acceptedMechanisms": ["bounded-conformance-campaign"], "minimumAssurance": "per-declaration-one-accepted-applicable-support-no-selected-challenge"},
    {"concern": "performance", "priority": "optional", "acceptedMechanisms": ["proof", "proof-audit"], "minimumAssurance": "per-declaration-one-accepted-applicable-support-no-selected-challenge"}
  ],
  "prohibitions": [
    {
      "proposition": {"specification": {"kind": "specification", "id": "stack", "version": "0.2.0"}, "declarationId": "stack-effects"},
      "description": "No io.* events inside a freshly evidenced adapter-observed invocation trace.",
      "eventPattern": "io.*",
      "acceptedEvidenceScope": ["adapter-invocation-trace"]
    }
  ]
}
